{
  "$schema": "https://json-schema.org/draft/2020-12/schema",
  "$id": "https://openiso.dev/schema/canonical-symbols-v1.json",
  "title": "OpenIso Canonical Symbols v1",
  "type": "object",
  "required": ["format", "schema_version", "format_version", "generated_at", "source", "symbols"],
  "properties": {
    "format": {
      "type": "string",
      "const": "OpenIso.Canonical"
    },
    "schema_version": {
      "type": "integer",
      "minimum": 1
    },
    "format_version": {
      "type": "string"
    },
    "generated_at": {
      "type": "string",
      "format": "date-time"
    },
    "source": {
      "type": "object",
      "required": ["type", "name"],
      "properties": {
        "type": {
          "type": "string"
        },
        "name": {
          "type": "string"
        },
        "release_version": {
          "type": "string"
        }
      },
      "additionalProperties": true
    },
    "symbols": {
      "type": "array",
      "items": {
        "type": "object",
        "required": ["symbol_code", "group_key", "subgroup_key", "origin", "iso_behavior", "last_change", "geometry"],
        "properties": {
          "symbol_code": {
            "type": "string",
            "minLength": 1
          },
          "name": {
            "type": "string"
          },
          "group_key": {
            "type": "string"
          },
          "subgroup_key": {
            "type": "string"
          },
          "description": {
            "type": "string"
          },
          "origin": {
            "type": "object",
            "required": ["kind"],
            "properties": {
              "kind": {
                "type": "string",
                "enum": ["standard", "project"]
              },
              "standard_ref": {
                "type": "string"
              },
              "project_ref": {
                "type": "string"
              },
              "note": {
                "type": "string"
              }
            },
            "additionalProperties": true
          },
          "versioning": {
            "type": "object",
            "properties": {
              "upstream_symbol_version": {
                "type": "integer",
                "minimum": 1
              },
              "local_revision": {
                "type": "integer",
                "minimum": 1
              },
              "payload_hash": {
                "type": "string",
                "pattern": "^sha256:[a-fA-F0-9]+$"
              },
              "changed_at": {
                "type": "string",
                "format": "date-time"
              },
              "change_reason": {
                "type": "string",
                "minLength": 1
              },
              "change_ticket": {
                "type": "string"
              },
              "last_synced_release_version": {
                "type": "string"
              },
              "sync_state": {
                "type": "string",
                "enum": ["synced", "conflict", "upstream_newer", "deprecated_upstream"]
              }
            },
            "additionalProperties": true
          },
          "connectors": {
            "type": "array",
            "items": {
              "type": "object",
              "required": ["kind", "x", "y"],
              "properties": {
                "kind": {
                  "type": "string",
                  "enum": ["arrive", "leave", "tee", "spindle"]
                },
                "x": {
                  "type": "number"
                },
                "y": {
                  "type": "number"
                }
              },
              "additionalProperties": true
            }
          },
          "geometry": {
            "type": "object",
            "required": ["segments"],
            "properties": {
              "units": {
                "type": "string"
              },
              "segments": {
                "type": "array",
                "items": {
                  "type": "object",
                  "required": ["type"],
                  "properties": {
                    "type": {
                      "type": "string",
                      "enum": ["line", "arc", "polyline", "polygon", "ellipse"]
                    }
                  },
                  "additionalProperties": true
                }
              },
              "areas": {
                "type": "array",
                "items": {
                  "type": "object",
                  "required": ["kind", "boundary"],
                  "properties": {
                    "id": {
                      "type": "string",
                      "minLength": 1
                    },
                    "kind": {
                      "type": "string",
                      "enum": ["fill", "hatch"]
                    },
                    "boundary": {
                      "type": "array",
                      "items": {
                        "type": "array",
                        "items": {
                          "type": "number"
                        },
                        "minItems": 2,
                        "maxItems": 2
                      },
                      "minItems": 3
                    },
                    "style": {
                      "type": "object",
                      "additionalProperties": true
                    },
                    "hatch": {
                      "type": "object",
                      "additionalProperties": true
                    }
                  },
                  "additionalProperties": true
                }
              }
            },
            "additionalProperties": true
          },
          "iso_behavior": {
            "type": "object",
            "properties": {
              "orientation_deg": {
                "type": "number"
              },
              "show_flow_arrow": {
                "type": "boolean"
              },
              "depends_on_flow": {
                "type": "boolean"
              },
              "show_dimensions": {
                "type": "boolean"
              },
              "user_can_edit": {
                "type": "boolean"
              }
            },
            "additionalProperties": true
          },
          "last_change": {
            "type": "object",
            "required": ["date", "reason"],
            "properties": {
              "date": {
                "type": "string",
                "format": "date-time"
              },
              "reason": {
                "type": "string",
                "minLength": 1
              },
              "author": {
                "type": "string"
              }
            },
            "additionalProperties": true
          },
          "attribute_schema_version": {
            "type": "integer",
            "minimum": 1
          },
          "attributes": {
            "type": "object",
            "additionalProperties": true
          }
        },
        "additionalProperties": true
      }
    }
  },
  "additionalProperties": false
}
